<?xml version="1.0"?>
<!DOCTYPE Report
[
<!ELEMENT Report (General ,(Doc|BPT)) >
<!ATTLIST Report ver CDATA #REQUIRED tmZone CDATA #REQUIRED>

<!ELEMENT General ( DocLocation ) >
<!ATTLIST General productName CDATA #REQUIRED productVer CDATA #REQUIRED os CDATA #REQUIRED host CDATA #REQUIRED qcserver CDATA #IMPLIED qcproject CDATA #IMPLIED SolManSolutionId CDATA #IMPLIED SolManProjectId CDATA #IMPLIED SolManTestPlanId CDATA #IMPLIED SolManTestPackageId CDATA #IMPLIED SolManUserInfoData CDATA #IMPLIED  >

<!ELEMENT BPT (DName,Res,DVer?,TSet?,TInst?,NodeArgs,AdditionalInfo*,Doc*) >
<!ATTLIST BPT rID ID #REQUIRED >

<!ELEMENT Doc (DName,ConfName?,Res,DVer?,TSet?,TInst?,RunType?,DT?,AdditionalInfo*,Step*,DIter*,Step*,Action*,Doc*,Summary?,TestMaintenanceSummary*,NodeArgs?) >
<!ATTLIST Doc rID ID #REQUIRED type (Test|BC|BPTWrapperTest|Flow|Group|Action) "Test" productName CDATA #REQUIRED BCIter CDATA #IMPLIED >

<!ELEMENT RunType ( #PCDATA )>
<!ATTLIST RunType fmStep (False|True) "False" batch (False|True) "False" upDesc (False|True) "False" upChk (False|True) "False" upAS (False|True) "False">

<!ELEMENT DName ( #PCDATA ) >

<!ELEMENT ConfName ( #PCDATA ) >

<!ELEMENT Res ( #PCDATA ) >

<!ELEMENT AdditionalInfo (AdditionalDataName,AdditionalDataValue ) >

<!ELEMENT AdditionalDataName ( #PCDATA ) >

<!ELEMENT AdditionalDataValue ( #PCDATA ) >

<!ELEMENT DVer ( #PCDATA ) >

<!ELEMENT TSet ( #PCDATA ) >

<!ELEMENT TInst ( #PCDATA ) >

<!ELEMENT DIter (Step*,Action+,Summary?,NodeArgs)>
<!ATTLIST DIter rID ID #REQUIRED iterID CDATA #REQUIRED>

<!ELEMENT DocLocation ( #PCDATA )>

<!ELEMENT Action (AName,AIter*,(Step|HtmlStep|Action)*, Summary,ActionMaintenanceSummary*, NodeArgs ) >
<!ATTLIST Action rID ID #REQUIRED>

<!ELEMENT AIter ((Step|HtmlStep|Action)*,DataMapping?, Summary?,NodeArgs) >
<!ATTLIST AIter rID ID #REQUIRED iterID CDATA #REQUIRED isCountable (False|True) "False" >

<!ELEMENT AName ( #PCDATA ) >

<!ELEMENT TestMaintenanceSummary (ActionMaintenanceSummary*) >
<!ATTLIST TestMaintenanceSummary ObjectsAdded CDATA #REQUIRED ObjectsUpdated CDATA #REQUIRED StepsUpdated CDATA #REQUIRED StepsComments CDATA #REQUIRED><!ELEMENT ActionMaintenanceSummary (ObjectChange* ) >
<!ATTLIST ActionMaintenanceSummary Action CDATA #REQUIRED Objects CDATA #REQUIRED Updated CDATA #REQUIRED LinesTotal CDATA #REQUIRED Added CDATA #REQUIRED LinesUpdated CDATA #REQUIRED>

<!ELEMENT ObjectChange  (Hierarchy, PropertyChangeList* ) >
<!ATTLIST ObjectChange Operation CDATA #IMPLIED OriginalRepository CDATA #IMPLIED>

<!ELEMENT PropertyChangeList (PropertyDef*) >

<!ELEMENT PropertyDef (OriginalValue, NewValue) >
<!ATTLIST PropertyDef PropName CDATA #REQUIRED OriginRegularExpression (True|False) "False" NewRegularExpression (True|False) "False" AddedProperty (True|False) "False" >

<!ELEMENT OriginalValue ( #PCDATA )>

<!ELEMENT NewValue ( #PCDATA )>

<!ELEMENT Hierarchy  (ObjectName, Hierarchy*) >
<!ATTLIST Hierarchy MicClass CDATA #REQUIRED>

<!ELEMENT ObjectName  ( #PCDATA ) >

<!ELEMENT Step (Obj,Details,Time,TimeTick* ,(Step|HtmlStep|Doc)*, DataMapping?, NodeArgs) >
<!ATTLIST Step rID ID #REQUIRED retval CDATA #IMPLIED>

<!ELEMENT HtmlStep (HTML,TimeTick*,(Step|HtmlStep|Doc)*,NodeArgs) >
<!ATTLIST HtmlStep rID ID #REQUIRED >

<!ELEMENT Obj ( #PCDATA ) >
<!ATTLIST Obj plainTxt (False|True) "True">

<!ELEMENT Details ( #PCDATA ) >
<!ATTLIST Details plainTxt (False|True) "True">

<!ELEMENT Time ( #PCDATA ) >

<!ELEMENT HTML ( #PCDATA ) >

<!ELEMENT Disp ( #PCDATA ) >

<!ELEMENT TimeTick ( #PCDATA ) >

<!ELEMENT DataMapping ( DataMappedItem* )>
<!ELEMENT DataMappedItem EMPTY >
<!ATTLIST DataMappedItem dsName CDATA #REQUIRED >
<!ATTLIST DataMappedItem rowId CDATA #REQUIRED >

<!ELEMENT NodeArgs (Disp,TopPane?,BtmPane?,ExtendedInfo? )>
<!ATTLIST NodeArgs eType CDATA #REQUIRED icon CDATA #REQUIRED nRep CDATA #REQUIRED UserNote CDATA #IMPLIED filter (False|True) "True">
<!ATTLIST NodeArgs status (Passed|Failed|Done|Warning|Information) "Done">
<!ATTLIST NodeArgs iconSel CDATA #IMPLIED nType CDATA #IMPLIED MovieMarker CDATA "">
<!ATTLIST NodeArgs Source CDATA #IMPLIED SourceLine CDATA #IMPLIED StepFlowItemKey CDATA #IMPLIED >

<!ELEMENT TopPane (Path)>

<!ELEMENT BtmPane ( (Path|WR)?,ASHilite?)>
<!ATTLIST BtmPane vType CDATA "HTML">

<!ELEMENT Path ( #PCDATA ) >

<!ELEMENT ASHilite ( #PCDATA ) >

<!ELEMENT WR ( #PCDATA ) >

<!ELEMENT ExtendedInfo ( StepData ) >

<!ATTLIST ExtendedInfo StepType CDATA #REQUIRED>
<!ELEMENT DT (NodeArgs) >
<!ATTLIST DT rID ID #REQUIRED>

<!ELEMENT Summary (Param*)>
<!ATTLIST Summary sTime CDATA #IMPLIED eTime CDATA #IMPLIED passed CDATA #IMPLIED failed CDATA #IMPLIED warnings CDATA #IMPLIED retval CDATA #IMPLIED stopped (False|True) "False" >

<!ELEMENT Param (ParamName,ParamVal)+ >
<!ATTLIST Param paramInOut (In|Out) "In">

<!ELEMENT ParamName ( #PCDATA ) >

<!ELEMENT ParamVal ( #PCDATA ) >

]
>
<Report ver="2.0" tmZone="GMT Standard Time">
<General productName="Micro Focus Unified Functional Testing" productVer="15.0.2" os="" host="AO2SIT919R2"><DocLocation><![CDATA[C:\Advanced Sales\Automation\Test Scripts\Recycle_TC_06]]></DocLocation></General>
<Doc rID="T1"   productName= "Micro Focus Unified Functional Testing"  >
<DName><![CDATA[Recycle_TC_06]]></DName>
<Res><![CDATA[Report]]></Res>
<DT rID="T2">
<NodeArgs eType="Table" icon="815" nRep="4" filter="False" >
<Disp><![CDATA[Run-Time Data Table]]></Disp>
<BtmPane vType="Table" >
<Path><![CDATA[Default.xlsx]]></Path>
</BtmPane>
</NodeArgs>
</DT>
<DIter rID="T3" iterID="1" >
<Action rID="T4">
<AName><![CDATA[Action1]]></AName>
<Step rID="T5">
<Obj plainTxt="False" ><![CDATA[LoadFunctionLibrary]]></Obj>
<Details plainTxt="False" ><![CDATA[LoadFunctionLibrary function passed]]></Details>
<Time><![CDATA[4/28/2021 - 5:09:03]]></Time>
<TimeTick>1619582943</TimeTick>
<NodeArgs eType="Replay" icon="818" nRep="8" status="Passed" Source="Action1" SourceLine="-1" >
<Disp><![CDATA[LoadFunctionLibrary]]></Disp>
</NodeArgs>
</Step>
<Step rID="T6">
<Obj plainTxt="False" ><![CDATA[LoadFunctionLibrary]]></Obj>
<Details plainTxt="False" ><![CDATA[UFT could not load the following function libraries because they contain syntax errors: C:\Advanced Sales\Automation\Function Library\Recycle.qfl]]></Details>
<Time><![CDATA[4/28/2021 - 5:09:03]]></Time>
<TimeTick>1619582943</TimeTick>
<NodeArgs eType="Replay" icon="818" nRep="9" status="Failed" Source="Action1" SourceLine="-1" >
<Disp><![CDATA[LoadFunctionLibrary]]></Disp>
</NodeArgs>
</Step>
<Step rID="T7">
<Obj plainTxt="False" ><![CDATA[Oracle Retail Xstore Point]]></Obj>
<Details plainTxt="False" ><![CDATA[JavaWindow]]></Details>
<Time><![CDATA[4/28/2021 - 5:09:07]]></Time>
<TimeTick>1619582947</TimeTick>
<Step rID="T8">
<Obj plainTxt="False" ><![CDATA[Main Menu.Exist]]></Obj>
<Details plainTxt="False" ><![CDATA["Object does not exist"]]></Details>
<Time><![CDATA[4/28/2021 - 5:09:07]]></Time>
<TimeTick>1619582947</TimeTick>
<NodeArgs eType="Replay" icon="820" nRep="12" Source="Action1" SourceLine="-1" >
<Disp><![CDATA[Main Menu.Exist]]></Disp>
</NodeArgs>
</Step>
<Step rID="T9">
<Obj plainTxt="False" ><![CDATA[Log Off.Exist]]></Obj>
<Details plainTxt="False" ><![CDATA["Object does not exist"]]></Details>
<Time><![CDATA[4/28/2021 - 5:09:09]]></Time>
<TimeTick>1619582949</TimeTick>
<NodeArgs eType="Replay" icon="821" nRep="14" >
<Disp><![CDATA[Log Off.Exist]]></Disp>
</NodeArgs>
</Step>
<Step rID="T10">
<Obj plainTxt="False" ><![CDATA[Back Office.Exist]]></Obj>
<Details plainTxt="False" ><![CDATA["Object does not exist"]]></Details>
<Time><![CDATA[4/28/2021 - 5:09:11]]></Time>
<TimeTick>1619582951</TimeTick>
<NodeArgs eType="Replay" icon="821" nRep="16" >
<Disp><![CDATA[Back Office.Exist]]></Disp>
</NodeArgs>
</Step>
<Step rID="T11">
<Obj plainTxt="False" ><![CDATA[Back Office Login.Set]]></Obj>
<Details plainTxt="False" ><![CDATA["100"]]></Details>
<Time><![CDATA[4/28/2021 - 5:09:11]]></Time>
<TimeTick>1619582951</TimeTick>
<NodeArgs eType="Replay" icon="822" nRep="18" >
<Disp><![CDATA[Back Office Login.Set]]></Disp>
</NodeArgs>
</Step>
<Step rID="T12">
<Obj plainTxt="False" ><![CDATA[Back Office Login.Activate]]></Obj>
<Details plainTxt="False" ><![CDATA[]]></Details>
<Time><![CDATA[4/28/2021 - 5:09:11]]></Time>
<TimeTick>1619582951</TimeTick>
<NodeArgs eType="Replay" icon="822" nRep="20" >
<Disp><![CDATA[Back Office Login.Activate]]></Disp>
</NodeArgs>
</Step>
<Step rID="T13">
<Obj plainTxt="False" ><![CDATA[Back Office Login.SetSecure]]></Obj>
<Details plainTxt="False" ><![CDATA["5fad465bbaab8ecd3c73e570d644"]]></Details>
<Time><![CDATA[4/28/2021 - 5:09:11]]></Time>
<TimeTick>1619582951</TimeTick>
<NodeArgs eType="Replay" icon="822" nRep="22" >
<Disp><![CDATA[Back Office Login.SetSecure]]></Disp>
</NodeArgs>
</Step>
<Step rID="T14">
<Obj plainTxt="False" ><![CDATA[Back Office Login.Activate]]></Obj>
<Details plainTxt="False" ><![CDATA[]]></Details>
<Time><![CDATA[4/28/2021 - 5:09:11]]></Time>
<TimeTick>1619582951</TimeTick>
<NodeArgs eType="Replay" icon="822" nRep="24" >
<Disp><![CDATA[Back Office Login.Activate]]></Disp>
</NodeArgs>
</Step>
<Step rID="T15">
<Obj plainTxt="False" ><![CDATA[Override.Exist]]></Obj>
<Details plainTxt="False" ><![CDATA["Object does not exist"]]></Details>
<Time><![CDATA[4/28/2021 - 5:09:17]]></Time>
<TimeTick>1619582957</TimeTick>
<NodeArgs eType="Replay" icon="821" nRep="26" >
<Disp><![CDATA[Override.Exist]]></Disp>
</NodeArgs>
</Step>
<Step rID="T16">
<Obj plainTxt="False" ><![CDATA[Yes.Exist]]></Obj>
<Details plainTxt="False" ><![CDATA["Object exists"]]></Details>
<Time><![CDATA[4/28/2021 - 5:09:19]]></Time>
<TimeTick>1619582959</TimeTick>
<NodeArgs eType="Replay" icon="821" nRep="27" >
<Disp><![CDATA[Yes.Exist]]></Disp>
</NodeArgs>
</Step>
<Step rID="T17">
<Obj plainTxt="False" ><![CDATA[Yes.Click]]></Obj>
<Details plainTxt="False" ><![CDATA["LEFT"]]></Details>
<Time><![CDATA[4/28/2021 - 5:09:19]]></Time>
<TimeTick>1619582959</TimeTick>
<NodeArgs eType="Replay" icon="821" nRep="29" >
<Disp><![CDATA[Yes.Click]]></Disp>
</NodeArgs>
</Step>
<Step rID="T18">
<Obj plainTxt="False" ><![CDATA[Confirm.Exist]]></Obj>
<Details plainTxt="False" ><![CDATA["Object exists"]]></Details>
<Time><![CDATA[4/28/2021 - 5:09:21]]></Time>
<TimeTick>1619582961</TimeTick>
<NodeArgs eType="Replay" icon="821" nRep="30" >
<Disp><![CDATA[Confirm.Exist]]></Disp>
</NodeArgs>
</Step>
<Step rID="T19">
<Obj plainTxt="False" ><![CDATA[Confirm.Click]]></Obj>
<Details plainTxt="False" ><![CDATA["LEFT"]]></Details>
<Time><![CDATA[4/28/2021 - 5:09:21]]></Time>
<TimeTick>1619582961</TimeTick>
<NodeArgs eType="Replay" icon="821" nRep="32" >
<Disp><![CDATA[Confirm.Click]]></Disp>
</NodeArgs>
</Step>
<Step rID="T20">
<Obj plainTxt="False" ><![CDATA[Back_2.Exist]]></Obj>
<Details plainTxt="False" ><![CDATA["Object exists"]]></Details>
<Time><![CDATA[4/28/2021 - 5:09:24]]></Time>
<TimeTick>1619582964</TimeTick>
<NodeArgs eType="Replay" icon="821" nRep="33" >
<Disp><![CDATA[Back_2.Exist]]></Disp>
</NodeArgs>
</Step>
<Step rID="T21">
<Obj plainTxt="False" ><![CDATA[Back_2.Click]]></Obj>
<Details plainTxt="False" ><![CDATA["LEFT"]]></Details>
<Time><![CDATA[4/28/2021 - 5:09:24]]></Time>
<TimeTick>1619582964</TimeTick>
<NodeArgs eType="Replay" icon="821" nRep="35" >
<Disp><![CDATA[Back_2.Click]]></Disp>
</NodeArgs>
</Step>
<Step rID="T22">
<Obj plainTxt="False" ><![CDATA[Back_2.Exist]]></Obj>
<Details plainTxt="False" ><![CDATA["Object exists"]]></Details>
<Time><![CDATA[4/28/2021 - 5:09:26]]></Time>
<TimeTick>1619582966</TimeTick>
<NodeArgs eType="Replay" icon="821" nRep="36" >
<Disp><![CDATA[Back_2.Exist]]></Disp>
</NodeArgs>
</Step>
<NodeArgs eType="Context" icon="819" nRep="11" Source="Action1" SourceLine="-1" >
<Disp><![CDATA[Oracle Retail Xstore Point]]></Disp>
</NodeArgs>
</Step>
<Step rID="T23">
<Obj ><![CDATA[Back_2 button not displayed]]></Obj>
<Details ><![CDATA[Button not displayed]]></Details>
<Time><![CDATA[4/28/2021 - 5:09:26]]></Time>
<TimeTick>1619582966</TimeTick>
<NodeArgs eType="User" icon="823" nRep="37" status="Passed" >
<Disp><![CDATA[Back_2 button not displayed]]></Disp>
</NodeArgs>
</Step>
<Step rID="T24">
<Obj plainTxt="False" ><![CDATA[Oracle Retail Xstore Point]]></Obj>
<Details plainTxt="False" ><![CDATA[JavaWindow]]></Details>
<Time><![CDATA[4/28/2021 - 5:09:28]]></Time>
<TimeTick>1619582968</TimeTick>
<Step rID="T25">
<Obj plainTxt="False" ><![CDATA[Back_2.Exist]]></Obj>
<Details plainTxt="False" ><![CDATA["Object exists"]]></Details>
<Time><![CDATA[4/28/2021 - 5:09:28]]></Time>
<TimeTick>1619582968</TimeTick>
<NodeArgs eType="Replay" icon="821" nRep="39" >
<Disp><![CDATA[Back_2.Exist]]></Disp>
</NodeArgs>
</Step>
<NodeArgs eType="Context" icon="819" nRep="38" >
<Disp><![CDATA[Oracle Retail Xstore Point]]></Disp>
</NodeArgs>
</Step>
<Step rID="T26">
<Obj ><![CDATA[Back_2 button not displayed]]></Obj>
<Details ><![CDATA[Button not displayed]]></Details>
<Time><![CDATA[4/28/2021 - 5:09:28]]></Time>
<TimeTick>1619582968</TimeTick>
<NodeArgs eType="User" icon="823" nRep="40" status="Passed" >
<Disp><![CDATA[Back_2 button not displayed]]></Disp>
</NodeArgs>
</Step>
<Step rID="T27">
<Obj plainTxt="False" ><![CDATA[Oracle Retail Xstore Point]]></Obj>
<Details plainTxt="False" ><![CDATA[JavaWindow]]></Details>
<Time><![CDATA[4/28/2021 - 5:09:30]]></Time>
<TimeTick>1619582970</TimeTick>
<Step rID="T28">
<Obj plainTxt="False" ><![CDATA[Back_2.Exist]]></Obj>
<Details plainTxt="False" ><![CDATA["Object exists"]]></Details>
<Time><![CDATA[4/28/2021 - 5:09:30]]></Time>
<TimeTick>1619582970</TimeTick>
<NodeArgs eType="Replay" icon="821" nRep="42" >
<Disp><![CDATA[Back_2.Exist]]></Disp>
</NodeArgs>
</Step>
<NodeArgs eType="Context" icon="819" nRep="41" >
<Disp><![CDATA[Oracle Retail Xstore Point]]></Disp>
</NodeArgs>
</Step>
<Step rID="T29">
<Obj ><![CDATA[Back_2 button not displayed]]></Obj>
<Details ><![CDATA[Button not displayed]]></Details>
<Time><![CDATA[4/28/2021 - 5:09:30]]></Time>
<TimeTick>1619582970</TimeTick>
<NodeArgs eType="User" icon="823" nRep="43" status="Passed" >
<Disp><![CDATA[Back_2 button not displayed]]></Disp>
</NodeArgs>
</Step>
<Step rID="T30">
<Obj plainTxt="False" ><![CDATA[Oracle Retail Xstore Point]]></Obj>
<Details plainTxt="False" ><![CDATA[JavaWindow]]></Details>
<Time><![CDATA[4/28/2021 - 5:09:32]]></Time>
<TimeTick>1619582972</TimeTick>
<Step rID="T31">
<Obj plainTxt="False" ><![CDATA[Back_2.Exist]]></Obj>
<Details plainTxt="False" ><![CDATA["Object exists"]]></Details>
<Time><![CDATA[4/28/2021 - 5:09:32]]></Time>
<TimeTick>1619582972</TimeTick>
<NodeArgs eType="Replay" icon="821" nRep="45" >
<Disp><![CDATA[Back_2.Exist]]></Disp>
</NodeArgs>
</Step>
<NodeArgs eType="Context" icon="819" nRep="44" >
<Disp><![CDATA[Oracle Retail Xstore Point]]></Disp>
</NodeArgs>
</Step>
<Step rID="T32">
<Obj ><![CDATA[Back_2 button not displayed]]></Obj>
<Details ><![CDATA[Button not displayed]]></Details>
<Time><![CDATA[4/28/2021 - 5:09:32]]></Time>
<TimeTick>1619582972</TimeTick>
<NodeArgs eType="User" icon="823" nRep="46" status="Passed" >
<Disp><![CDATA[Back_2 button not displayed]]></Disp>
</NodeArgs>
</Step>
<Step rID="T33">
<Obj plainTxt="False" ><![CDATA[Oracle Retail Xstore Point]]></Obj>
<Details plainTxt="False" ><![CDATA[JavaWindow]]></Details>
<Time><![CDATA[4/28/2021 - 5:09:34]]></Time>
<TimeTick>1619582974</TimeTick>
<Step rID="T34">
<Obj plainTxt="False" ><![CDATA[Back_2.Exist]]></Obj>
<Details plainTxt="False" ><![CDATA["Object exists"]]></Details>
<Time><![CDATA[4/28/2021 - 5:09:34]]></Time>
<TimeTick>1619582974</TimeTick>
<NodeArgs eType="Replay" icon="821" nRep="48" >
<Disp><![CDATA[Back_2.Exist]]></Disp>
</NodeArgs>
</Step>
<NodeArgs eType="Context" icon="819" nRep="47" >
<Disp><![CDATA[Oracle Retail Xstore Point]]></Disp>
</NodeArgs>
</Step>
<Step rID="T35">
<Obj ><![CDATA[Back_2 button not displayed]]></Obj>
<Details ><![CDATA[Button not displayed]]></Details>
<Time><![CDATA[4/28/2021 - 5:09:34]]></Time>
<TimeTick>1619582974</TimeTick>
<NodeArgs eType="User" icon="823" nRep="49" status="Passed" >
<Disp><![CDATA[Back_2 button not displayed]]></Disp>
</NodeArgs>
</Step>
<Step rID="T36">
<Obj plainTxt="False" ><![CDATA[Oracle Retail Xstore Point]]></Obj>
<Details plainTxt="False" ><![CDATA[JavaWindow]]></Details>
<Time><![CDATA[4/28/2021 - 5:09:36]]></Time>
<TimeTick>1619582976</TimeTick>
<Step rID="T37">
<Obj plainTxt="False" ><![CDATA[Back_2.Exist]]></Obj>
<Details plainTxt="False" ><![CDATA["Object exists"]]></Details>
<Time><![CDATA[4/28/2021 - 5:09:36]]></Time>
<TimeTick>1619582976</TimeTick>
<NodeArgs eType="Replay" icon="821" nRep="51" >
<Disp><![CDATA[Back_2.Exist]]></Disp>
</NodeArgs>
</Step>
<NodeArgs eType="Context" icon="819" nRep="50" >
<Disp><![CDATA[Oracle Retail Xstore Point]]></Disp>
</NodeArgs>
</Step>
<Step rID="T38">
<Obj ><![CDATA[Back_2 button not displayed]]></Obj>
<Details ><![CDATA[Button not displayed]]></Details>
<Time><![CDATA[4/28/2021 - 5:09:36]]></Time>
<TimeTick>1619582976</TimeTick>
<NodeArgs eType="User" icon="823" nRep="52" status="Passed" >
<Disp><![CDATA[Back_2 button not displayed]]></Disp>
</NodeArgs>
</Step>
<Step rID="T39">
<Obj plainTxt="False" ><![CDATA[Oracle Retail Xstore Point]]></Obj>
<Details plainTxt="False" ><![CDATA[JavaWindow]]></Details>
<Time><![CDATA[4/28/2021 - 5:09:38]]></Time>
<TimeTick>1619582978</TimeTick>
<Step rID="T40">
<Obj plainTxt="False" ><![CDATA[Back_2.Exist]]></Obj>
<Details plainTxt="False" ><![CDATA["Object exists"]]></Details>
<Time><![CDATA[4/28/2021 - 5:09:38]]></Time>
<TimeTick>1619582978</TimeTick>
<NodeArgs eType="Replay" icon="821" nRep="54" >
<Disp><![CDATA[Back_2.Exist]]></Disp>
</NodeArgs>
</Step>
<NodeArgs eType="Context" icon="819" nRep="53" >
<Disp><![CDATA[Oracle Retail Xstore Point]]></Disp>
</NodeArgs>
</Step>
<Step rID="T41">
<Obj ><![CDATA[Back_2 button not displayed]]></Obj>
<Details ><![CDATA[Button not displayed]]></Details>
<Time><![CDATA[4/28/2021 - 5:09:38]]></Time>
<TimeTick>1619582978</TimeTick>
<NodeArgs eType="User" icon="823" nRep="55" status="Passed" >
<Disp><![CDATA[Back_2 button not displayed]]></Disp>
</NodeArgs>
</Step>
<Step rID="T42">
<Obj plainTxt="False" ><![CDATA[Oracle Retail Xstore Point]]></Obj>
<Details plainTxt="False" ><![CDATA[JavaWindow]]></Details>
<Time><![CDATA[4/28/2021 - 5:09:40]]></Time>
<TimeTick>1619582980</TimeTick>
<Step rID="T43">
<Obj plainTxt="False" ><![CDATA[Back_2.Exist]]></Obj>
<Details plainTxt="False" ><![CDATA["Object exists"]]></Details>
<Time><![CDATA[4/28/2021 - 5:09:40]]></Time>
<TimeTick>1619582980</TimeTick>
<NodeArgs eType="Replay" icon="821" nRep="57" >
<Disp><![CDATA[Back_2.Exist]]></Disp>
</NodeArgs>
</Step>
<NodeArgs eType="Context" icon="819" nRep="56" >
<Disp><![CDATA[Oracle Retail Xstore Point]]></Disp>
</NodeArgs>
</Step>
<Step rID="T44">
<Obj ><![CDATA[Back_2 button not displayed]]></Obj>
<Details ><![CDATA[Button not displayed]]></Details>
<Time><![CDATA[4/28/2021 - 5:09:40]]></Time>
<TimeTick>1619582980</TimeTick>
<NodeArgs eType="User" icon="823" nRep="58" status="Passed" >
<Disp><![CDATA[Back_2 button not displayed]]></Disp>
</NodeArgs>
</Step>
<Step rID="T45">
<Obj plainTxt="False" ><![CDATA[Oracle Retail Xstore Point]]></Obj>
<Details plainTxt="False" ><![CDATA[JavaWindow]]></Details>
<Time><![CDATA[4/28/2021 - 5:09:42]]></Time>
<TimeTick>1619582982</TimeTick>
<Step rID="T46">
<Obj plainTxt="False" ><![CDATA[Back_2.Exist]]></Obj>
<Details plainTxt="False" ><![CDATA["Object exists"]]></Details>
<Time><![CDATA[4/28/2021 - 5:09:42]]></Time>
<TimeTick>1619582982</TimeTick>
<NodeArgs eType="Replay" icon="821" nRep="60" >
<Disp><![CDATA[Back_2.Exist]]></Disp>
</NodeArgs>
</Step>
<NodeArgs eType="Context" icon="819" nRep="59" >
<Disp><![CDATA[Oracle Retail Xstore Point]]></Disp>
</NodeArgs>
</Step>
<Step rID="T47">
<Obj ><![CDATA[Back_2 button not displayed]]></Obj>
<Details ><![CDATA[Button not displayed]]></Details>
<Time><![CDATA[4/28/2021 - 5:09:42]]></Time>
<TimeTick>1619582982</TimeTick>
<NodeArgs eType="User" icon="823" nRep="61" status="Passed" >
<Disp><![CDATA[Back_2 button not displayed]]></Disp>
</NodeArgs>
</Step>
<Step rID="T48">
<Obj plainTxt="False" ><![CDATA[Stop Run]]></Obj>
<Details plainTxt="False" ><![CDATA[Run stopped by user.]]></Details>
<Time><![CDATA[4/28/2021 - 5:09:42]]></Time>
<TimeTick>1619582982</TimeTick>
<NodeArgs eType="General" icon="824" nRep="62" status="Information" >
<Disp><![CDATA[Stop Run]]></Disp>
</NodeArgs>
</Step>
<Summary sTime="4/28/2021 - 5:08:59" eTime="4/28/2021 - 5:09:42" passed="10" failed="1" warnings="0" ></Summary>
<NodeArgs eType="StartAction" icon="817" nRep="7" status="Failed" >
<Disp><![CDATA[Action1 Summary]]></Disp>
</NodeArgs>
</Action>
<NodeArgs eType="StartIteration" icon="816" nRep="6" status="Failed" >
<Disp><![CDATA[Recycle_TC_06 Iteration 1 (Row 1)]]></Disp>
</NodeArgs>
</DIter>
<Summary sTime="4/28/2021 - 5:08:58" eTime="4/28/2021 - 5:09:42" passed="10" failed="1" warnings="0" ></Summary>
<NodeArgs eType="StartTest" icon="814" nRep="3" status="Failed" >
<Disp><![CDATA[Test Recycle_TC_06 Summary]]></Disp>
</NodeArgs>
</Doc>
</Report>